{
  "generatedAt": "2026-07-29T02:00:00.000Z",
  "workspace": {
    "id": "workspace-clinic-1",
    "name": "Phòng khám Shcare",
    "type": "clinic",
    "workspaceType": "clinic",
    "status": "active",
    "packageId": "pkg-clinic",
    "subscriptionStatus": "active",
    "billingCycle": "monthly"
  },
  "package": {
    "id": "pkg-clinic",
    "name": "Clinic",
    "price": 1200000,
    "currency": "VND",
    "duration": "monthly",
    "features": {
      "cloudStorage": true,
      "analytics": true
    }
  },
  "subscription": {
    "id": "",
    "organizationId": "workspace-clinic-1",
    "packageId": "pkg-clinic",
    "status": "active",
    "billingCycle": "monthly",
    "source": "workspace",
    "startedAt": "2026-07-01T00:00:00.000Z",
    "renewsAt": "",
    "canceledAt": "",
    "createdAt": "2026-07-01T00:00:00.000Z",
    "updatedAt": "2026-07-29T02:00:00.000Z"
  },
  "usage": {
    "doctors": 2,
    "patients": 3,
    "devices": 1,
    "aiMonthly": 4,
    "storageGb": 0.25,
    "storageMetric": "total_storage"
  },
  "quota": {
    "maxDoctors": 5,
    "maxPatients": 100,
    "maxDevices": 10,
    "storageGb": 10,
    "aiMonthly": 100,
    "retentionDays": 30
  },
  "usageRows": [
    {
      "key": "doctors",
      "label": "Bác sĩ / nhân sự",
      "used": 2,
      "limit": 5,
      "unit": "người",
      "percent": 40,
      "status": "ok"
    },
    {
      "key": "patients",
      "label": "Bệnh nhân",
      "used": 3,
      "limit": 100,
      "unit": "hồ sơ",
      "percent": 3,
      "status": "ok"
    },
    {
      "key": "devices",
      "label": "Thiết bị",
      "used": 1,
      "limit": 10,
      "unit": "thiết bị",
      "percent": 10,
      "status": "ok"
    },
    {
      "key": "aiMonthly",
      "label": "Lượt AI tháng",
      "used": 4,
      "limit": 100,
      "unit": "lượt",
      "percent": 4,
      "status": "ok"
    },
    {
      "key": "storageGb",
      "label": "Dung lượng lưu trữ",
      "used": 0.25,
      "limit": 10,
      "unit": "GB",
      "percent": 3,
      "status": "ok"
    }
  ],
  "currentCharge": {
    "packageId": "pkg-clinic",
    "amount": 1200000,
    "currency": "VND",
    "cycle": "monthly",
    "source": "service_package"
  },
  "billingContact": {
    "name": "Phòng khám Shcare",
    "email": "billing@example.test",
    "phone": "0281234567",
    "address": "Hồ Chí Minh"
  },
  "invoicePolicy": {
    "mode": "manual",
    "providerConfigured": false,
    "message": "Shcare ghi nhận gói dịch vụ và liên hệ thanh toán ở cấp workspace."
  }
}
